Ergot (Original Mix),Damian Lazarus,Crosstown Rebels present SPIRITS III
Five (Original Mix),Dennis Cruz,Show Me / Five
JENNY IS DANCING (SALSA MIX),GOLFOS,GOLFOS IN THE CLUB / JENNY IS DANCING
10AM Fuse (Original Mix),Seb Zito,Theory To Start EP
Nova (Original Mix),MPH,Nova
Bodyworkin (Original Mix),"Tapesh, High Soundsystem",Bodyworkin
19,Piem,19
Paranoia (Original Mix),"John Tejada, Qzen",Palette Recordings #BeatportDecade Tech House
Whispers In The Wind (Original Mix),Michael Bibi,Summer Sampler 2021
Isolate Ctrl (Original Mix),Michael Bibi,2019 Ibiza Sampler
Stay With Me (Original Mix),Sergio Sergi,Stay With Me
Waiting For You (Original Mix),"Sydney Blu, Dantiez",Waiting For You
Little Helper 389-3 (Original Mix),Butane,Little Helpers 389
HOLE 9 (BIRDIE MIX),GOLFOS,HOLE 9 / 2C
Jammin and Slammin (Original Mix),Sandile,DJ-Kicks: Cinthie
Vibing (Original Mix),Detlef,Summer Sampler 2021
Nesrib (2019 Remaster),SIS,Nesrib (Archie Hamilton's Nose Rub)
Bumbum (Original Mix),Groove Killah,Bumbum EP
Down (Original Mix),Otistic (DE),Ibiza Deep House Megamix 2021
Baby (Original Mix),Avision,In My Mind
Tell Me (Original Mix),Ken Kelly,Close To You
020 (Original Mix),Niteplan,Temptation
Slab (Original Mix),Chaos In The CBD,Slab - EP
Fairytale Frequency (Original Mix),"Jamie Jones, Alan Fitzpatrick",Fairytale Frequency
Ouhweha (Original Mix),Chicks Luv Us,Eyes Like Paradise
Eyes Like Paradise (Original Mix),Chicks Luv Us,Eyes Like Paradise
Coffee in the Morning (Dub Mix),"Dam Swindle, Jitwam",Coffee in the Morning EP
Bang Bang (Original mix),"HouseBreakers, Alex Bohemien, Raf Parola",ADE 2019
I'm Quiet (Extended Mix),Prok & Fitch,Salmodia EP
Esta Noche (Original Mix),YOUniverse (IT),Esta Noche
"Mind, Body & Soul",Elléot,Human Emotions EP
The Birds (Original Mix),Cosmicfellas,The Birds
More Power (Original Mix),"Cosmicfellas, BICHO",More Power EP
Everybody (Original Mix),"Franky Rizardo, Motion Sky",Everybody EP
Dancing Like Madonna (Original Mix),"Rendher, Richard Ulh",Talk Of The Town EP
Stopped World (Original Mix),Alexic Rod,Stay At Home
Detox (Original Mix),Alexic Rod,Stay At Home
Still Doesn't Care (Original Mix),Luuk Van Dijk,Doesn't Care EP
Be Sharp Say Nowt (Original Mix),Patrick Topping,Be Sharp Say Nowt
The Funk (Original Mix),Andre Zimmer,Welcome to Hell
Indiance (Original Mix),Prok & Fitch,Indiance
Seeing & Believing (Extended Version),Chris Stussy,Across Ocean
Feels Good feat. HanLei (Extended Mix),"Josh Butler, Hanlei",Feels Good
Goodie Bag (Original Mix),Eddy M,Summer Sampler 2020
Show Me (Original Mix),Eddy M,Show Me / Five
Patience (Archie Hamilton Remix),Toman,Otro Mundo
Toma Dale (Original Mix),"Nfasis, Classmatic",Toma Dale
Forget (Extended Mix),"Prok & Fitch, Mizbee",Forget EP
Really Really Hot (Original Mix),Eddy M,Really Really Hot
Exit (Original Mix),Sante Sansone,"Raw Grooves, Vol.3"
El Primer Corazón (Original Mix),Classmatic,El Primer Corazón EP
Bape (Original Mix),Classmatic,Toma Dale
Your Loving Hand (Original Mix),Blackchild (ITA),City Cutz EP
Forget The Past (Original Mix),Classmatic,Forget The Past
FEELING GOOD (JBL MIX),GOLFOS,FEELING GOOD / WE HERE
Overzealous (Original Mix),Mr. Nunez,Bubbling
Chill Bill (Original Mix),Brisotti,Chill Bill
Bayside,Obskür,Bayside
Caress Me (Original Mix),Ben Hemsley,Caress Me
Feel Good (Original Mix),mrT & SimoV,Feel Good
Angel Dust (Original Mix),PAWSA,Double Trouble EP
On Me (Original Mix),"Mizbee, Nic Joseph",On Me
IPAP (Original Mix),"Joe Vanditti, Michel Tallè",IPAP
Let's Get This (Original Mix),Sally C,Big Saldo's Chunker 001
G TALES (Original Mix),Viot,GOOD FOR ME
Señorita (Original Mix),Classmatic,Forget The Past
Looking For (Original Mix),Dennis Cruz,Ready For The Blues
Cirque Du Freak (Original Mix),Azteca,One Time
Groove La Afrika (Original Mix),Mele,Soul on Ice EP PT1
2001 (Original Mix),Daniel Steinberg,2001
The Green Light (Original Mix),Darius Syrossian,The Green Light
Sides (Original Mix),"Latmun, Iglesias",Just Like / Sides
Everybody Dancing (Original Mix),Luke Alessi,Feelin' Love / Everybody Dancing - EP
Cloud (Extended Mix),Gruuve,Cloud
Stay With Me (Original Mix),Late Delivery,Fashion
Virgo's Victory (Stripped Mix),Charlie Soul Clap,Virgo's Victory / Soul Fed
Rat's a Rat (Original Mix),Eden Burns,Big Beat Manifesto Vol III
Closer (Original Mix),Jaden Thompson,Cuttin' Headz Presents Boogeyman
Thirsty Eyes (Original Mix),Jaden Thompson,Thirsty Eyes
Dance For You (Original Mix),Carlo Gambino,Dance For You
What a Bam (Original Mix),"George Privatti, Guille Placencia",What a Bam
The Inspector (Original Mix),Guille Placencia,The Inspector
Red Light (Original Mix),Sunday Noise,Red Light
Flamingo (Original Mix),Guille Placencia,Mamma Jamma
Out of My Mind (Original Mix),Sunday Noise,Red Light
Stereo (Original Mix),Motion Sky,Hand on the Button
Grab Dat Ass All Night (Original Mix),"YTP, Kiddy.Wav",Level up My Skills
U Won't C Me (Original Mix),Mystic Bill,U Won't C Me EP
No Hay Mañana (Club Mix),"Hector Oaks, COCO-PALOMA",No Hay Mañana
Stop It (Original Mix),Di Chiara Brothers,Rock It
Nasty (Original Mix),Sally C,Big Saldo's Chunker 002
Fairground (Jesse Maas Remix),Elleot,Circus EP PT1
Kilombito Mal (feat. Antonia Montero) (Original Mix),Toman,Kilombito Mal
Gunshots (Original Mix),Giulio Cadri,Halloween 2019
Third Eye (Original Mix),"Reelow, Proudly People",Third Eye EP
Loh Flaite (Original Mix),Pablo Inzunza,Friki Friki
Purple Chips (Original Mix),Kareem Cali,Basement Beats
Engine No 5 (Original Mix),Alan Nieves,They Mad
Cuba Libre (Original Mix),"Carlo Lio, Carabetta",Cuba Libre
Funx (Original Mix),"Gianni Ruocco, Andre Salmon, Le Roi Carmona",Funx
Nu Sound of Disko (Original Mix),"Andre Salmon, Teddy Wong",Funx
Fever (Original Mix),Dennis Cruz,2016 Ibiza Sampler
ticket to childhood (Original Mix),Vladimir Dubyshkin,The Botox Queen
Ravinghook (Original Mix),Rafa Barrios,Ravinghook
FANTASY ISLAND (Original Mix),Wheats,THE BLACKOUT EP
Paradiso (Original Mix),Toman,Kilombito Mal
Fever (Original Mix),Dimmish,Fever
Levante feat. Miki Sax (Original Mix),Qubiko,Levante (feat. Miki Sax)
You Da Shit Girl feat. LATASHÁ (Harry Romero Extended Remix),"Latasha, Dave + Sam",You Da Shit Girl
Cocaina (Original Mix),Mason Talbot,Cocaina
Poke Bowl (Original Mix),Dennis Cruz,2022 Ibiza Sampler
Talk (Original Mix),Bassel Darwish,2022 Ibiza Sampler
Perreo (Extended Mix),"VLTRA (IT), Francis De Simone",Perreo (Extended Mix)
Dropppout (Original Mix),"Rendher, Ssero",Dropppout EP
Like A G (Original Mix),Goosey,Like A G
Wurk That (Original Mix),Niteplan,Wurk That
Dale (Drunk & Play V.I.P Edit),"Sergio Sergi, Drunk & Play",Dale (EP)
Lit Bit (Original Mix),Gabriele Toma,Lit Bit EP
Dips (Original Mix),"Andre Salmon, Dantiez",Dips
Dueño De Una Vision (Original Mix),Dateless,Dueño De Una Vision
Little Bit feat. Missy (Original Mix),"Missy, Andre Salmon, Gettoblaster",Little Bit
The Attention Deficit Track (Terrace Mix),"Skream, Jackmaster",The Attention Deficit Track
Bump (Original Mix),Latmun,Tonight EP
She Looks (Original Mix),James Dexter,Almost Time EP & Tuccillo remix
Locht (Original Mix),Chicks Luv Us,Locht EP
Tic Tac (Original Mix),DJ Fronter,Tic Tac EP
Swang,VITO (UK),Swang
Hero (Original Mix),Toni Varga,Basement Beats Volume 5
Take Over (Original Mix),"Tony Dee, Manomic",Basement Beats Volume 5
Take Me High (Original Mix),"HATS 93, Fresh Stuffi",Basement Beats Volume 5
Ritmo Rico (Original Mix),Carloh,Ritmo Rico EP
Make You Feel (Original Mix),Ben Murphy,Make You Feel
Space Beats (Original Mix),Robert James,Space Beats EP
El Carrateo (Original Mix),Carlo Lio,Boogie Man EP
Boogie Man (Original Mix),Carlo Lio,Boogie Man EP
No Stoppin' (Original Mix),Black Fancy,M.M.M
Turns Me On (Extended Mix),Santi Dominguez,OG Groove
Overrated Pleasures (Original Mix),Fred Dekker,Overrated Pleasures EP
Feels Right (Original Mix),YOUniverse (IT),Feels Right
The Risk feat. guerrA. (Original Mix),Cla$$ & JCult,The Risk
Tunes feat. Fresh Stuff (Original Mix),Cla$$ & JCult,The Risk
Black Box (Original Mix),ANOTR,"EXPO Series 001, Pt. 2"
Big Prize (Original Mix),"Obando, Matheo Velez",Big Prize
Puff Of Smoke (Original Mix),Hatiras,No Feelings
On N On (Original Mix),Viot,Prisoner
Prisoner (Original Mix),Viot,Prisoner
Worn Out (Original Mix),Wess,Welcome To The Party
Nostalgia (Original Mix),Wess,Welcome To The Party
What If I fall (Original Mix),Pablo Inzunza,Friki Friki
Ready for this Shit (Original Mix),Mike Teknii,ThinkThank
Atto Di Fede (Original Mix),Mike Teknii,ThinkThank
Selfish (Original Mix),Guilherme Rossi,Basement Beats Volume 4
Raw booty (Original Mix),"Kricked, Dahveed (LA)",Basement Beats Volume 4
Shut Your Mouth (Original Mix),"Omar Labastida, Fhaken",Basement Beats Volume 4
1010 Street (Original Mix),Jean Pierre,Tambor Street
Quickly (Original Mix),Proudly People,Acid Jungle EP
Clown Beat (Original Mix),"Aldo Cadiz, Andre Butano",Clown Beat EP
Hood Shit (Original Mix),"Carlo Lio, MC Flipside",Hood Shit EP
Girl Meets Boy (Original Mix),"Carlo Lio, Nathan Barato",Girl Meets Boy
Deep Inside (Original Mix),Daniel Orpi,Deep Inside
Turntable (Original Mix),"Paolo Martini, Federico Ambrosi",Superfunk
Superfunk (Original Mix),"Paolo Martini, Federico Ambrosi",Superfunk
Behaviour (Original Mix),"Paolo Martini, Federico Ambrosi",Superfunk
Locked Up (Original Mix),Lonely,Locked Up
Around Me (Original Mix),Cristhian Balcazar,Basement Beats Vol. 3
Gym Queen (Original Mix),K-Mack,Basement Beats Vol. 3
The Knowledge (Original Mix),Wess,Basement Beats Vol. 3
Marvin The Martian (Original Mix),"Andre Salmon, Kricked",Raw Stuff
Handsup (Original Mix),"Andre Salmon, M.F.S: Observatory",Raw Stuff
Slow Down (Original Mix),Gaston Pillo,Slow Down
Gently (Original Mix),Rooleh,Gently
Skyline (Original Mix),Samu.l,SKYLINE
Shawty (Original Mix),Dabi,Shawty
Junkz (Original Mix),Niteplan,Junkz
I WANNA (Original Mix),Joey London Style,FLAVA
FLAVA (Original Mix),Joey London Style,FLAVA
Izza Anthem (Original Mix),Ben Balance,Izza Anthem E.P.
Symphony (Original Mix),Mauro Venti,Sirens EP
Hallucinate (Original Mix),Alisha,Visions EP
Wrong Impression (Original Mix),Eddy M,2022 Ibiza Sampler
Superfly (Extended Mix),Endor,Superfly
A Better Light (The Martinez Brothers Cuttin' Headz Dub),Santos Resiak,A Better Light
Room Service (24 Hour Extended Mix),PAWSA,Room Service (24 Hour Mix)
Something Spectacular (Original Mix),PAWSA,2022 Ibiza Sampler
Chit Chat (Original Mix),Reelow,2022 Ibiza Sampler
Paint A Picture (Original Mix),ANOTR,Paint A Picture EP
For You (Original Mix),"Denney, James Dexter",Katsu
Don't You (Original Mix),Eddy M,No More EP
Jazz Fusic (Original Mix),"Chris Lattner, Enzo Siragusa",Jazz Fusic EP
Epiphany (Original Mix),WILLF,"PIV ADE Sampler '21, Pt. 2"
Corte Ficha (Original Mix),Aldo Cadiz,Corte Ficha EP
Bankrolls (Original Mix),Eurostep,Bankrolls
All Day Long (I Hear My Telephone Ring),Pablo Pepstasy,Baby Love
Trapped In,Sirus Hood,Cuttin' Headz presents EPisode One
Out Of Service (Original Mix),Antss,Rave
Muzik X-Press (Skylark Remix 2008),X-Press 2,Muzik Xpress
Sleep Like A Stoner (Michael Bibi Remix),Iglesias,Sleep Like A Stoner EP
Sativa Jazz (Detlef Remix),"Abana, Detlef",Sativa Jazz (Detlef Remix)
House de Bassin (Asquith NY Remix),Adrien Calvet,House de Bassin (Asquith NY Remix)
Solid Drink (Original Mix),Aldo Cadiz,Corte Ficha EP
Strike (Original Mix),Aldo Cadiz,Corte Ficha EP
Led By Machines (Extended Mix),Ammo Avenue,Lost Planet EP
La Put-A de Tu Madre (Original Mix),Andre Salmon,Memories
Volcano (Original Mix),"Andre Salmon, Alejandro Vasconez",Volcano
Let's Have Fun (Original Mix),"Andre Salmon, Chicks Luv Us, YSFK",Let's Have Fun
Have You (Original Mix),"Andre Salmon, Nick Edwards",Have You
Saxy Hands (Andrew Azara Red Room Mix),"Andrey Djackonda, Elleot",Saxy Hands
Mine Today (Original Mix),Ant Klent,Mine Today EP
Fly Life (Paco Osuna Remix),"Basement Jaxx, Paco Osuna",Fly Life
Disco Era Dub (Original Mix),Blackchild (ITA),Disco Era Dub
When We Used To Play (original Mix),Blake Baxter,When We Used To Play
ENUFF (Re-Edit),"Carlo Lio, Andre Salmon",ENUFF
Makelene (Original Mix),Chicks Luv Us,Can We Dance
Can We Dance (Original Mix),"Chicks Luv Us, Malikk",Can We Dance
MFK (Original Mix),"Cla$$ & JCult, Beltran (BR)",MFK
Catuca (Original Mix),"Classmatic, Mc Th",Cuttin' Headz presents Episode One
Cat Nap (Original Mix),Craig & Grant Gordon,Cat Nap EP
We Bring It (Original Mix),"Darius Syrossian, Jamie Jones",We Bring It
Love Against The World (Original Mix),Demuir,Estrella EP
Fire On (Original Mix),Dennis Cruz,Ready To Roll
Mochis (Original Mix),Dennis Cruz,So Sweet
A Conversation (Original Mix),Dernis,Deep Cutz
Da Creepin' Wasp (Original Mix),"DJ Life, Reflex Blue",Meganeura
Breaking Bad (Original Mix),Eddy M,Breaking Bad
Crocodile Tears (Original Mix),Eddy M,Breaking Bad
Get Ready (Original Mix),Eddy M,Keep Trying
Keep Trying (Original Mix),Eddy M,Keep Trying
Don't Forget To Go Home (Original Mix),"Emanuel Satie, Billy Cobham",Don't Forget To Go Home
Wallop (Original Mix),Fold,Netflix & Chill EP
Moonlite (Original Mix),Functionist,Moonlite
Bocat (Michael Bibi Remix),"Guy Gerber, Albertina, Michael Bibi",Bocat (Remixes)
Muleña (Original Mix),"Hammer, KILIMANJARO (UK)",Muleña EP
Get It Up (Original Mix),"Jean Pierre, Daniel Orpi",Rush
Unknown 001,Jizz,Unknown 001
Nitty Gritty (Original Mix),"Joseph Edmund, Mason Collective",Whippin Heat
Worldwide (Original Mix),Kevin Knapp,Worldwide
Never Return (Original Mix),Legit Trip,Never Return
Talkie Walkie (Original Mix),Malikk,Can We Dance
Swingers & Groovers (Original Mix),Marc Cotterell,Swingers & Groovers
Occult Rhythms (Original Mix),MEEN,Occult Rhythms
Mobbin' (Original Mix),Moise Keane,Power Moves
What Is (Latmun Remix),"Nicole Moudaber, Latmun",Mood Elevation Vol. 3
Cross The Lake (Original Mix),"Paul C, Paolo Martini",Blah Blah Blah / Cross The Lake
Raysun (Original Mix),"Paul C, Paolo Martini",Raysun EP
Meri Jaan (Original Mix),"Piem, Richard Ulh",Meri Jaan
Snappy (Original Mix),"Piem, Richard Ulh",Snappy
609 Palm Canyon (Original Mix),Pierre Codarin,Pierre Codarin 008
Violeiro (Original Mix),Prequel,Love (I Heard You Like Heartbreak)
Colores (Original Mix),Rafa Barrios,Secret Weapons
All of A Sudden (Original Mix),Rendher,All of A Sudden EP
The Funky Sound (Original Mix),Rob Stillekens,Shake It On Down
Un Poco Mas Duro (Original Mix),Sunday Noise,Un Poco Mas Duro EP
Been A While (Extended Mix),Tomi&Kesh,Heavy Hitter EP
Heavy Hitter (Extended Mix),Tomi&Kesh,Heavy Hitter EP
Sippin (Original Mix),VLTRA (IT),Sippin / Tempo
Toast (Original Mix),Ivan Lopez,La Mafia Vol.5
So Good (Javi Bora Remix),Carloh,So Good
You're so Fine (Original Mix),Chelina Manuhutu,You're so Fine
Monopoly Joystick (Original Mix),Franky Rizardo,Roxy's Sweat EP
GIRLS LIKE THIS (SUMMER EDIT),GOLFOS,BUCKET HEAD / GIRLS LIKE THIS
Franklin (Original Mix),LondonGround,Barcelona Off 2018
That's Right (Original Mix),Will Taylor (UK),That's Right / The Maze
Mewafill (Original Mix),Stefano Kosa,Basement Beats Volume 5
Lemonade (Original Mix),Michael Bibi,Lemonade
Bansuri Feel (Original Mix),Chinonegro,Bansuri Feel
Use To It (Original Mix),Daniel Orpi,Rush
Kill The Soundboy (Original Mix),Denney,Crosstown Rebels present SPIRITS V
Thank U Feat. Eman (Rossi. Remix),Leon (Italy),Thank U EP
No Me Importa,Marco Tropeano,No Me Importa
Pan Praise,Mat.Joe,Pan Praise
Baddie (Original Mix),Niteplan,Baddie
Ahora (Original Mix),"Sunday Noise, David INK",Un Poco Mas Duro EP
"Mind, Body & Soul (Original Mix)","Andrey Djackonda, Elleot",Human Emotions EP
Our Time feat Molly Green (Original Mix),"Archie Hamilton, Molly Green",R:Evolution EP
U & ME (Original Mix),Dale Howard,U & ME
Sientelo (Original Mix),Daniel Orpi,Cuttin' Headz presents Episode One
No More (Original Mix),Eddy M,No More EP
Mi Ritmo (Original Mix),Gabriele Toma,Welcome to Hell
Without You (Original Mix),"GuerrA., Classmatic",Without You
Mandingueu (Original Mix),Hector Couto,Plastico Fino EP
Turned Turk (Original Mix),KinAhau,Turned Turk
Throw (Original Mix),"Paperclip People, Carl Craig",Sessions
WE MOVE (EXTENDED MIX),PAWSA,WE MOVE
Booze & Pills (Extended Mix),"Prok & Fitch, Amine Edge & DANCE",Booze & Pills
She Got Me On (Original Mix),Paul Johnson,She Got Me On
Fever (Original Mix),"Route 94, Eda Eren",Fever
Rose (Original Mix),Chicks Luv Us,Locht EP
Jazzy Candy (Original Mix),Eddy M,The Funky Rebirth EP
Catwalk (Original Mix),AG Swifty,Catwalk EP
KAMELEON (Original Mix),Angel Heredia,KAMELEON
The Best Thing (Original Mix),"Darius Syrossian, Jamie Jones",We Bring It
Bass Drop feat. Lil Mz 313,"DJ Godfather, Lil Mz 313",This Detroit Thing of Ours
Don't Owe Me (Original Mix),Lawrence Friend,Don't Owe Me EP
Not Perfect (Original Mix),"Shyam P, Late Replies",Not Perfect
Mas Amor (Original Mix),Purple Ice,Mas Amor
Come To Get Her (Original Mix),Inavo,Come To Get Her
I Love (Extended Mix),Harry Romero,I Love / The City
Allez Ally (Shonky Remix),El Prevost,Allez Ally Remixes
